{
  "id": "inc_000000000000a0f1",
  "reference": "0412-261026",
  "call_type": "domestic_incident",
  "grade": "G1",
  "grade_history": [ { "at": "2026-10-26T22:14:05+00:00", "grade": "G1", "by": "AI_DISPATCH", "reason": "Ongoing domestic, risk of harm" } ],
  "status": "en_route",
  "created_at": "2026-10-26T22:13:40+00:00",
  "target_attend_by": "2026-10-26T22:28:40+00:00",
  "source": "999",
  "caller": { "npc_id": "npc_00a1b2c3d4e5f607", "anonymous": false, "relationship": "neighbour" },
  "location": { "bng": { "e": 394210.0, "n": 398870.0 }, "address_id": "adr_0000000000031c2e", "description": "Terraced house, shouting and banging heard", "beat": "TA-ASH-03" },
  "detail_flags": ["ongoing", "children_present"],
  "subjects": [ { "npc_id": "npc_00000000000b7711", "role": "victim" }, { "npc_id": "npc_00000000000b7712", "role": "suspect" } ],
  "risk": { "method": "DASH", "level": "medium", "answers": {} },
  "assigned_units": ["TA21", "TA24"],
  "log": [
    { "at": "2026-10-26T22:13:40+00:00", "author": "SYSTEM", "kind": "system", "text": "999 call received." },
    { "at": "2026-10-26T22:14:05+00:00", "author": "AI_DISPATCH", "kind": "grade", "text": "Graded G1: ongoing domestic, children present." },
    { "at": "2026-10-26T22:14:30+00:00", "author": "AI_DISPATCH", "kind": "assignment", "text": "TA21, TA24 assigned." },
    { "at": "2026-10-26T22:14:41+00:00", "author": "TA21", "kind": "status", "text": "En route." }
  ],
  "sensitivity": "domestic_abuse"
}
